{
  "schema_version": "voice_pack.v1",
  "voice_pack_version": "vp_4a91cc02",
  "contact_id": "h_8f21a4c0",
  "scope": "contact",
  "n_exemplars": 8,
  "register": {
    "median_len_chars": 34,
    "p90_len_chars": 88,
    "emoji_rate": 0.11,
    "top_emoji": [
      "😭",
      "🙏"
    ],
    "punctuation": "lowercase_no_period",
    "greeting_rate": 0.04,
    "signoff_rate": 0.0,
    "abbreviations": [
      "lmk",
      "rn",
      "ngl",
      "prob",
      "tmrw"
    ],
    "avg_msgs_per_burst": 2.3,
    "question_rate": 0.31,
    "apology_openers": [
      "sorry been mia",
      "omg sorry"
    ]
  },
  "exemplars": [
    "sorry been mia this week, work has been insane",
    "omg yes im so down. what day were u thinking",
    "lmk when ur free and ill come thru",
    "wait i totally forgot to reply to this",
    "ok that works for me",
    "ngl i completely spaced on that",
    "prob gonna be late but ill be there",
    "can i let u know tmrw"
  ],
  "as_of": "2026-08-01T09:14:00Z"
}
